Date,Product_Name,Product_Price
2025-12-02,Vital Farms Pasture Raised Eggs,4.41 $
2025-12-02,Horizon Organic High Vitamin D Milk,1.07 $
2025-12-02,"Nature&#39;s Own Honey Wheat Bread - 20oz,3.32",3.66 $
2025-12-02,Kraft Singles American Cheese Slices - 16oz/24ct,13.02 $
2025-12-02,Fresh Banana - each - Good &#38; Gather&#8482;,1.68 $
2025-12-02,Fresh Navel Orange - each,4.46 $
2025-12-02,Fresh Gala Apple - each,5.24 $
2025-12-02,Fresh Organic Roma Tomatoes - 1lb,4.90 $
2025-12-02,Fresh Iceberg Lettuce Head - each,2.22 $
