Date,Product_Name,Product_Price
2026-01-25,Vital Farms Pasture Raised Eggs,4.40 $
2026-01-25,Horizon Organic High Vitamin D Milk,1.06 $
2026-01-25,"Nature&#39;s Own Honey Wheat Bread - 20oz,3.32",3.31 $
2026-01-25,Kraft Singles American Cheese Slices - 16oz/24ct,5.89 $
2026-01-25,Fresh Banana - each - Good &#38; Gather&#8482;,0.76 $
2026-01-25,Fresh Navel Orange - each,2.01 $
2026-01-25,Fresh Gala Apple - each,2.37 $
2026-01-25,Fresh Organic Roma Tomatoes - 1lb,2.21 $
2026-01-25,Fresh Iceberg Lettuce Head - each,2.22 $
