Date,Product_Name,East_Price,West_Price,Cost_Of_Living
2025-12-27,Vital Farms Pasture Raised Eggs,6.89,8.39,4.41
2025-12-27,Horizon Organic High Vitamin D Milk,6.29,5.99,1.06
2025-12-27,Nature's Own Honey Wheat Bread,3.69,3.69,3.32
2025-12-27,Kraft Singles American Cheese Slices,3.99,4.19,5.91
2025-12-27,Fresh Banana,0.29,0.29,0.77
2025-12-27,Fresh Navel Orange,0.89,0.89,2.02
2025-12-27,Fresh Gala Apple,0.79,0.79,2.38
2025-12-27,Fresh Organic Roma Tomatoes,2.99,2.29,2.22
2025-12-27,Fresh Iceberg Lettuce Head,2.59,2.59,2.22
