Date,Product_Name,East_Price,West_Price,Cost_Of_Living
2025-12-12,Vital Farms Pasture Raised Eggs,6.89,8.39,4.41
2025-12-12,Horizon Organic High Vitamin D Milk,6.29,5.99,1.06
2025-12-12,Nature's Own Honey Wheat Bread,3.69,3.69,3.66
2025-12-12,Kraft Singles American Cheese Slices,4.89,4.99,13.03
2025-12-12,Fresh Banana,0.29,0.29,1.69
2025-12-12,Fresh Navel Orange,0.89,0.89,4.45
2025-12-12,Fresh Gala Apple,0.79,0.79,5.24
2025-12-12,Fresh Organic Roma Tomatoes,2.99,2.29,4.9
2025-12-12,Fresh Iceberg Lettuce Head,2.59,2.59,2.22
