Date,Product_Name,East_Price,West_Price,Cost_Of_Living
2025-12-02,Vital Farms Pasture Raised Eggs,6.89,8.39,4.41
2025-12-02,Horizon Organic High Vitamin D Milk,6.29,6.29,1.07
2025-12-02,Nature's Own Honey Wheat Bread,3.69,3.69,3.66
2025-12-02,Kraft Singles American Cheese Slices,4.89,4.99,13.02
2025-12-02,Fresh Banana,0.29,0.29,1.68
2025-12-02,Fresh Navel Orange,0.89,0.89,4.46
2025-12-02,Fresh Gala Apple,0.79,0.79,5.24
2025-12-02,Fresh Organic Roma Tomatoes,2.99,2.29,4.9
2025-12-02,Fresh Iceberg Lettuce Head,2.69,2.69,2.22
